{
  "objective": "Объяснить устройство вымышленной многоразовой упаковки",
  "audience": "Покупатели интернет-магазина, выбирающие многоразовую упаковку",
  "deliverables": [
    "Объясняющий ролик 30 секунд",
    "Вертикальная версия 15 секунд"
  ],
  "channels": [
    "сайт",
    "социальные сети"
  ],
  "launchDate": "2027-03-15",
  "budgetContext": "Учебный пример; бюджет согласуется отдельно, это не цена SHAR",
  "rightsConstraints": "До производства подтвердить права на дизайн, музыку и территории использования",
  "locales": [
    "ru"
  ],
  "aspectRatios": [
    "16:9",
    "9:16"
  ],
  "notes": "Синтетический пример, не реальный клиентский проект."
}
