{
  "objective": "Explain how a fictional refillable container works",
  "audience": "Online shoppers comparing reusable containers",
  "deliverables": [
    "30-second product explainer",
    "15-second vertical adaptation"
  ],
  "channels": [
    "website",
    "social media"
  ],
  "launchDate": "2027-03-15",
  "budgetContext": "Synthetic planning example; budget to be agreed, not a SHAR quote",
  "rightsConstraints": "Confirm product artwork, music and territory permissions before production",
  "locales": [
    "en"
  ],
  "aspectRatios": [
    "16:9",
    "9:16"
  ],
  "notes": "Synthetic demonstration. No real client or production measurements."
}
